{
  "changeset_id": "CS-0001-2026-01-07T13:35:00Z",
  "created_at": "2026-01-07T13:35:00Z",
  "actor": {
    "actor_id": "community-maintainers",
    "display_name": "Alexandrian Academy Maintainers",
    "roles": ["governance", "review"]
  },
  "operation": "PROMOTE_SANDBOX_TO_CANON",
  "targets": [
    {
      "object_type": "CurriculumPlan",
      "object_id": "EXAMPLE-CURRICULUM-PLAN",
      "from_status": "sandbox",
      "to_status": "canon",
      "object_sha256": "0000000000000000000000000000000000000000000000000000000000000000"
    }
  ],
  "evidence_refs": [
    "AegisVault://evidence/placeholder",
    "AriadneThread://anchor/placeholder"
  ],
  "justification": {
    "summary": "Promote the example CurriculumPlan from sandbox to canon for baseline testing.",
    "rationale": "This establishes a stable canonical example for CI and schema evolution.",
    "jurisdiction_profile_id": "US-PA::K12::BASELINE",
    "pedagogy_profile_id": "PED::MONTESSORI::BASELINE"
  }
}
