{
  "changeset_id": "CS-0002-2026-08-01T12:00:00Z",
  "created_at": "2026-08-01T12:00:00Z",
  "actor": {
    "actor_id": "ontogenesis-carrier-bridge",
    "display_name": "Ontogenesis Neuro-Symbolic Carrier Bridge",
    "roles": ["external-proposer"]
  },
  "operation": "PROMOTE_SANDBOX_TO_CANON",
  "targets": [
    {
      "object_type": "CurriculumPlan",
      "object_id": "EXAMPLE-NEUROSYMBOLIC-ONTOLOGY-RELATION",
      "from_status": "sandbox",
      "to_status": "canon",
      "object_sha256": "1111111111111111111111111111111111111111111111111111111111111111"
    }
  ],
  "evidence_refs": [
    "AegisVault://evidence/dON-RRN-inference-run-2026-07-30",
    "AriadneThread://anchor/dON-RRN-source-corpus-span-014"
  ],
  "justification": {
    "summary": "Promote a Deep-Ontological-Network-inferred curriculum relation after owning-plane review and grounding validation.",
    "rationale": "The candidate relation was proposed by an external neuro-symbolic method, held to grounded/verified status, and independently validated by Alexandrian Academy reviewers before promotion. Canonization authority remained with Alexandrian Academy throughout.",
    "jurisdiction_profile_id": "US-PA::K12::BASELINE",
    "pedagogy_profile_id": "PED::MONTESSORI::BASELINE"
  },
  "external_provenance": {
    "method_family": "deep_ontological_networks_rrn",
    "method_output_type": "inferred_ontology_relation",
    "source_system": "SocioProphet/ontogenesis",
    "grounding_status": "grounded",
    "validation_status": "validated",
    "explanation_trace_ref": "AriadneThread://replay/dON-RRN-inference-run-2026-07-30",
    "owning_authority_non_claim": true
  }
}
