{
  "$schema": "../platform-contracts/schemas/changeset.schema.json",
  "changeset_id": "CHANGESET::AA::PROB-RP::PROMOTE-V2",
  "created_at": "2026-04-09T07:10:00Z",
  "actor": {
    "actor_id": "chatgpt-system",
    "display_name": "ChatGPT System",
    "roles": ["system", "author"]
  },
  "operation": "PROMOTE_SANDBOX_TO_CANON",
  "targets": [
    {
      "object_type": "curriculum_plan",
      "object_id": "CURR::AA::PROB-RP::v2",
      "from_status": "sandbox",
      "to_status": "canon"
    },
    {
      "object_type": "unit_map",
      "object_id": "UNITMAP::AA::PROB-RP::v2",
      "from_status": "sandbox",
      "to_status": "canon"
    },
    {
      "object_type": "assessment_plan",
      "object_id": "ASSESS::AA::PROB-RP::v2",
      "from_status": "sandbox",
      "to_status": "canon"
    }
  ],
  "evidence_refs": [
    "courses/probability-random-processes/atlas-codex/evidence-bundle.v1.json",
    "oracle-of-delphi/evaluations/probability-rp-initial-eval.json"
  ],
  "justification": {
    "summary": "Promotion of probability course objects to canon after schema alignment and initial Oracle evaluation.",
    "rationale": "Curriculum objects are schema-compliant, evidence-linked, and have initial Oracle evaluation indicating readiness with minor gaps.",
    "jurisdiction_profile_id": "GENERIC",
    "pedagogy_profile_id": "agentic.mastery.v1"
  }
}